{
  "approvals": [
    {
      "accepted_debt": [],
      "actions": [],
      "by": "user",
      "plan_hash": "98f27ad6d6f6f9db11f5bb5317159f99b0c33c28f147a4ca48de1330e62eb45a",
      "plan_version": 7,
      "revoked": null,
      "scope": "plan",
      "t": "2026-08-11T15:40:52.770967Z"
    }
  ],
  "batches": [],
  "branch": "main",
  "brief": "Harden the ingest script \u2014 add a coverage report, capture a field the vendor export hides in note text, and detect duplicates. Done when: ingest of a fresh export prints a clean delta + quality report.",
  "findings": [
    {
      "disposition": "fixed",
      "id": "r1-F001",
      "source": "plan-reviewer"
    },
    {
      "disposition": "fixed",
      "id": "r1-F002",
      "source": "plan-reviewer"
    },
    {
      "disposition": "fixed",
      "id": "r1-F003",
      "source": "plan-reviewer"
    },
    {
      "disposition": "fixed",
      "id": "r1-F004",
      "source": "plan-reviewer"
    },
    {
      "disposition": "fixed",
      "id": "r1-F005",
      "source": "plan-reviewer"
    },
    {
      "disposition": "fixed",
      "id": "r1-F006",
      "source": "plan-reviewer"
    },
    {
      "disposition": "fixed",
      "id": "r1-F007",
      "source": "plan-reviewer"
    },
    {
      "disposition": "fixed",
      "id": "r1-F008",
      "source": "plan-reviewer"
    },
    {
      "disposition": "fixed",
      "id": "r2-F001",
      "source": "plan-reviewer"
    },
    {
      "disposition": "fixed",
      "id": "r2-F002",
      "source": "plan-reviewer"
    },
    {
      "disposition": "fixed",
      "id": "r2-F003",
      "source": "plan-reviewer"
    },
    {
      "disposition": "fixed",
      "id": "r2-F004",
      "source": "plan-reviewer"
    },
    {
      "disposition": "fixed",
      "id": "r2-F005",
      "source": "plan-reviewer"
    },
    {
      "disposition": "fixed",
      "id": "r2-F006",
      "source": "plan-reviewer"
    },
    {
      "disposition": "fixed",
      "id": "r3-F001",
      "source": "plan-reviewer"
    },
    {
      "disposition": "fixed",
      "id": "r3-F002",
      "source": "plan-reviewer"
    },
    {
      "disposition": "fixed",
      "id": "r3-F003",
      "source": "plan-reviewer"
    },
    {
      "disposition": "fixed",
      "id": "r3-F004",
      "source": "plan-reviewer"
    },
    {
      "disposition": "fixed",
      "id": "r3-F005",
      "source": "plan-reviewer"
    },
    {
      "disposition": "fixed",
      "id": "r4-F001",
      "source": "plan-reviewer"
    },
    {
      "disposition": "fixed",
      "id": "r4-F002",
      "source": "plan-reviewer"
    },
    {
      "disposition": "fixed",
      "id": "r4-F003",
      "source": "plan-reviewer"
    },
    {
      "disposition": "fixed",
      "id": "r4-F004",
      "source": "plan-reviewer"
    },
    {
      "disposition": "fixed",
      "id": "r5-F001",
      "source": "plan-reviewer"
    },
    {
      "disposition": "fixed",
      "id": "r5-F002",
      "source": "plan-reviewer"
    },
    {
      "disposition": "fixed",
      "id": "r5-F003",
      "source": "plan-reviewer"
    },
    {
      "disposition": "accepted",
      "id": "r6-F001",
      "source": "plan-reviewer"
    },
    {
      "disposition": "accepted",
      "id": "r6-F002",
      "source": "plan-reviewer"
    },
    {
      "disposition": "accepted",
      "id": "r6-F003",
      "source": "plan-reviewer"
    },
    {
      "disposition": "fixed",
      "id": "r6-F004",
      "source": "plan-reviewer"
    }
  ],
  "git": {
    "dirty_at_start": [
      "app/f0002.txt",
      "app/f0010.txt",
      "app/f0018.txt",
      "app/f0026.txt",
      "app/f0034.txt",
      "app/f0042.txt",
      "app/f0050.txt",
      "app/f0058.txt",
      "app/f0066.txt",
      "app/f0074.txt",
      "app/f0082.txt",
      "app/f0090.txt",
      "app/f0098.txt",
      "app/f0106.txt",
      "app/f0114.txt",
      "app/f0122.txt",
      "app/f0130.txt",
      "app/f0138.txt",
      "app/f0146.txt",
      "app/f0154.txt",
      "app/f0162.txt",
      "app/f0170.txt",
      "app/f0178.txt",
      "app/f0186.txt",
      "app/f0194.txt",
      "app/f0202.txt",
      "app/f0210.txt",
      "app/f0218.txt",
      "app/f0226.txt",
      "app/f0234.txt",
      "app/f0242.txt",
      "app/f0250.txt",
      "app/f0258.txt",
      "app/f0266.txt",
      "app/f0274.txt",
      "app/f0282.txt",
      "app/f0290.txt",
      "app/f0298.txt",
      "app/f0306.txt",
      "app/f0314.txt",
      "app/f0322.txt",
      "app/f0330.txt",
      "app/f0338.txt",
      "app/f0346.txt",
      "app/f0354.txt",
      "app/f0362.txt",
      "app/f0370.txt",
      "app/f0378.txt",
      "app/f0386.txt",
      "app/f0394.txt",
      "app/f0402.txt",
      "app/f0410.txt",
      "app/f0418.txt",
      "app/f0426.txt",
      "app/f0434.txt",
      "app/f0442.txt",
      "app/f0450.txt",
      "app/f0458.txt",
      "app/f0466.txt",
      "app/f0474.txt",
      "app/f0482.txt",
      "app/f0490.txt",
      "app/f0498.txt",
      "app/f0506.txt",
      "app/f0514.txt",
      "app/f0522.txt",
      "app/f0530.txt",
      "app/f0538.txt",
      "app/f0546.txt",
      "app/f0554.txt",
      "app/f0562.txt",
      "app/f0570.txt",
      "app/f0578.txt",
      "app/f0586.txt",
      "app/f0594.txt",
      "app/f0602.txt",
      "app/f0610.txt",
      "app/f0618.txt",
      "app/f0626.txt",
      "app/f0634.txt",
      "app/f0642.txt",
      "app/f0650.txt",
      "app/f0658.txt",
      "app/f0666.txt",
      "app/f0674.txt",
      "app/f0682.txt",
      "app/f0690.txt",
      "app/f0698.txt",
      "app/f0706.txt",
      "app/f0714.txt",
      "app/f0722.txt",
      "assets/f0005.txt",
      "assets/f0013.txt",
      "assets/f0021.txt",
      "assets/f0029.txt",
      "assets/f0037.txt",
      "assets/f0045.txt",
      "assets/f0053.txt",
      "assets/f0061.txt",
      "assets/f0069.txt",
      "assets/f0077.txt",
      "assets/f0085.txt",
      "assets/f0093.txt",
      "assets/f0101.txt",
      "assets/f0109.txt",
      "assets/f0117.txt",
      "assets/f0125.txt",
      "assets/f0133.txt",
      "assets/f0141.txt",
      "assets/f0149.txt",
      "assets/f0157.txt",
      "assets/f0165.txt",
      "assets/f0173.txt",
      "assets/f0181.txt",
      "assets/f0189.txt",
      "assets/f0197.txt",
      "assets/f0205.txt",
      "assets/f0213.txt",
      "assets/f0221.txt",
      "assets/f0229.txt",
      "assets/f0237.txt",
      "assets/f0245.txt",
      "assets/f0253.txt",
      "assets/f0261.txt",
      "assets/f0269.txt",
      "assets/f0277.txt",
      "assets/f0285.txt",
      "assets/f0293.txt",
      "assets/f0301.txt",
      "assets/f0309.txt",
      "assets/f0317.txt",
      "assets/f0325.txt",
      "assets/f0333.txt",
      "assets/f0341.txt",
      "assets/f0349.txt",
      "assets/f0357.txt",
      "assets/f0365.txt",
      "assets/f0373.txt",
      "assets/f0381.txt",
      "assets/f0389.txt",
      "assets/f0397.txt",
      "assets/f0405.txt",
      "assets/f0413.txt",
      "assets/f0421.txt",
      "assets/f0429.txt",
      "assets/f0437.txt",
      "assets/f0445.txt",
      "assets/f0453.txt",
      "assets/f0461.txt",
      "assets/f0469.txt",
      "assets/f0477.txt",
      "assets/f0485.txt",
      "assets/f0493.txt",
      "assets/f0501.txt",
      "assets/f0509.txt",
      "assets/f0517.txt",
      "assets/f0525.txt",
      "assets/f0533.txt",
      "assets/f0541.txt",
      "assets/f0549.txt",
      "assets/f0557.txt",
      "assets/f0565.txt",
      "assets/f0573.txt",
      "assets/f0581.txt",
      "assets/f0589.txt",
      "assets/f0597.txt",
      "assets/f0605.txt",
      "assets/f0613.txt",
      "assets/f0621.txt",
      "assets/f0629.txt",
      "assets/f0637.txt",
      "assets/f0645.txt",
      "assets/f0653.txt",
      "assets/f0661.txt",
      "assets/f0669.txt",
      "assets/f0677.txt",
      "assets/f0685.txt",
      "assets/f0693.txt",
      "assets/f0701.txt",
      "assets/f0709.txt",
      "assets/f0717.txt",
      "assets/f0725.txt",
      "config/f0007.txt",
      "config/f0015.txt",
      "config/f0023.txt",
      "config/f0031.txt",
      "config/f0039.txt",
      "config/f0047.txt",
      "config/f0055.txt",
      "config/f0063.txt",
      "config/f0071.txt",
      "config/f0079.txt",
      "config/f0087.txt",
      "config/f0095.txt",
      "config/f0103.txt",
      "config/f0111.txt",
      "config/f0119.txt",
      "config/f0127.txt",
      "config/f0135.txt",
      "config/f0143.txt",
      "config/f0151.txt",
      "config/f0159.txt",
      "config/f0167.txt",
      "config/f0175.txt",
      "config/f0183.txt",
      "config/f0191.txt",
      "config/f0199.txt",
      "config/f0207.txt",
      "config/f0215.txt",
      "config/f0223.txt",
      "config/f0231.txt",
      "config/f0239.txt",
      "config/f0247.txt",
      "config/f0255.txt",
      "config/f0263.txt",
      "config/f0271.txt",
      "config/f0279.txt",
      "config/f0287.txt",
      "config/f0295.txt",
      "config/f0303.txt",
      "config/f0311.txt",
      "config/f0319.txt",
      "config/f0327.txt",
      "config/f0335.txt",
      "config/f0343.txt",
      "config/f0351.txt",
      "config/f0359.txt",
      "config/f0367.txt",
      "config/f0375.txt",
      "config/f0383.txt",
      "config/f0391.txt",
      "config/f0399.txt",
      "config/f0407.txt",
      "config/f0415.txt",
      "config/f0423.txt",
      "config/f0431.txt",
      "config/f0439.txt",
      "config/f0447.txt",
      "config/f0455.txt",
      "config/f0463.txt",
      "config/f0471.txt",
      "config/f0479.txt",
      "config/f0487.txt",
      "config/f0495.txt",
      "config/f0503.txt",
      "config/f0511.txt",
      "config/f0519.txt",
      "config/f0527.txt",
      "config/f0535.txt",
      "config/f0543.txt",
      "config/f0551.txt",
      "config/f0559.txt",
      "config/f0567.txt",
      "config/f0575.txt",
      "config/f0583.txt",
      "config/f0591.txt",
      "config/f0599.txt",
      "config/f0607.txt",